[
  {
    "about_me": "some string",
    "accept_rate": 1,
    "account_id": 1,
    "age": 1,
    "answer_count": 1,
    "badge_counts": {
      "bronze": 1,
      "gold": 1,
      "silver": 1
    },
    "creation_date": 1,
    "display_name": "some string",
    "down_vote_count": 1,
    "is_employee": true,
    "last_access_date": 1,
    "last_modified_date": 1,
    "link": "some string",
    "location": "some string",
    "profile_image": "some string",
    "question_count": 1,
    "reputation": 1,
    "reputation_change_day": 1,
    "reputation_change_month": 1,
    "reputation_change_quarter": 1,
    "reputation_change_week": 1,
    "reputation_change_year": 1,
    "timed_penalty_date": 1,
    "up_vote_count": 1,
    "user_id": 1,
    "user_type": "some string",
    "view_count": 1,
    "website_url": "some string"
  }
]